{
  "$schema": "../schema/testcase.json",
  "description": "A simple mustache with unescaped output",
  "template": "{{{ value }}}",
  "input": { "value": "abc & < > \" ' ` = 123" },
  "output": "abc & < > \" ' ` = 123",
  "ast": {
    "type": "Program",
    "body": [
      {
        "type": "MustacheStatement",
        "path": {
          "type": "PathExpression",
          "data": false,
          "depth": 0,
          "parts": ["value"],
          "original": "value",
          "loc": {
            "start": { "line": 1, "column": 4 },
            "end": { "line": 1, "column": 9 }
          }
        },
        "params": [],
        "escaped": false,
        "strip": { "open": false, "close": false },
        "loc": {
          "start": { "line": 1, "column": 0 },
          "end": { "line": 1, "column": 13 }
        }
      }
    ],
    "strip": {},
    "loc": {
      "start": { "line": 1, "column": 0 },
      "end": { "line": 1, "column": 13 }
    }
  }
}
