{
  "$schema": "../schema/testcase.json",
  "description": "A path expressions that is resolved to nothing yields an empty string",
  "template": "{{person.name}}",
  "input": { "person": "Max" },
  "ast": {
    "type": "Program",
    "body": [
      {
        "type": "MustacheStatement",
        "escaped": true,
        "params": [],
        "path": {
          "type": "PathExpression",
          "original": "person.name",
          "data": false,
          "depth": 0,
          "parts": ["person", "name"],
          "loc": {
            "start": { "line": 1, "column": 2 },
            "end": { "line": 1, "column": 13 }
          }
        },
        "strip": { "open": false, "close": false },
        "loc": {
          "start": { "line": 1, "column": 0 },
          "end": { "line": 1, "column": 15 }
        }
      }
    ],
    "strip": {},
    "loc": {
      "start": { "line": 1, "column": 0 },
      "end": { "line": 1, "column": 15 }
    }
  },
  "output": ""
}
