{
  "$schema": "../schema/testcase.json",
  "description": "Escaped mustache expression",
  "template": "\\{{abc}} \\{{{cde}}}",
  "input": {},
  "output": "{{abc}} {{{cde}}}",
  "ast": {
    "type": "Program",
    "body": [
      {
        "type": "ContentStatement",
        "value": "{{abc}} {{{cde}}}",
        "original": "\\{{abc}} \\{{{cde}}}",
        "loc": {
          "start": { "line": 1, "column": 0 },
          "end": { "line": 1, "column": 19 }
        }
      }
    ],
    "strip": {},
    "loc": {
      "start": { "line": 1, "column": 0 },
      "end": { "line": 1, "column": 19 }
    }
  },
  "originalAst": {
    "type": "Program",
    "body": [
      {
        "type": "ContentStatement",
        "value": "{{abc}} {{{cde}}}",
        "original": "{{abc}} {{{cde}}}",
        "loc": {
          "start": { "line": 1, "column": 1 },
          "end": { "line": 1, "column": 19 }
        }
      }
    ],
    "strip": {},
    "loc": {
      "start": { "line": 1, "column": 1 },
      "end": { "line": 1, "column": 19 }
    }
  }
}
