{
  "$schema": "../schema/testcase.json",
  "description": "White space around path expressions is",
  "template": "|- {{{~  \t\nname  \t\n}}} | {{{  \t\nname  \t\n~}}} -|- {{{~  \t\nname\t\n  ~}}} -|",
  "input": { "name": "joe" },
  "output": "|-joe | joe-|-joe-|",
  "ast": {
    "type": "Program",
    "body": [
      {
        "type": "ContentStatement",
        "value": "|-",
        "original": "|- ",
        "loc": {
          "start": { "line": 1, "column": 0 },
          "end": { "line": 1, "column": 3 }
        }
      },
      {
        "type": "MustacheStatement",
        "escaped": false,
        "params": [],
        "path": {
          "type": "PathExpression",
          "original": "name",
          "data": false,
          "depth": 0,
          "parts": ["name"],
          "loc": {
            "start": { "line": 2, "column": 0 },
            "end": { "line": 2, "column": 4 }
          }
        },
        "strip": { "open": true, "close": false },
        "loc": {
          "start": { "line": 1, "column": 3 },
          "end": { "line": 3, "column": 3 }
        }
      },
      {
        "type": "ContentStatement",
        "value": " | ",
        "original": " | ",
        "loc": {
          "start": { "line": 3, "column": 3 },
          "end": { "line": 3, "column": 6 }
        }
      },
      {
        "type": "MustacheStatement",
        "escaped": false,
        "params": [],
        "path": {
          "type": "PathExpression",
          "original": "name",
          "data": false,
          "depth": 0,
          "parts": ["name"],
          "loc": {
            "start": { "line": 4, "column": 0 },
            "end": { "line": 4, "column": 4 }
          }
        },
        "strip": { "open": false, "close": true },
        "loc": {
          "start": { "line": 3, "column": 6 },
          "end": { "line": 5, "column": 4 }
        }
      },
      {
        "type": "ContentStatement",
        "value": "-|-",
        "original": " -|- ",
        "loc": {
          "start": { "line": 5, "column": 4 },
          "end": { "line": 5, "column": 9 }
        }
      },
      {
        "type": "MustacheStatement",
        "escaped": false,
        "params": [],
        "path": {
          "type": "PathExpression",
          "original": "name",
          "data": false,
          "depth": 0,
          "parts": ["name"],
          "loc": {
            "start": { "line": 6, "column": 0 },
            "end": { "line": 6, "column": 4 }
          }
        },
        "strip": { "open": true, "close": true },
        "loc": {
          "start": { "line": 5, "column": 9 },
          "end": { "line": 7, "column": 6 }
        }
      },
      {
        "type": "ContentStatement",
        "value": "-|",
        "original": " -|",
        "loc": {
          "start": { "line": 7, "column": 6 },
          "end": { "line": 7, "column": 9 }
        }
      }
    ],
    "strip": {},
    "loc": {
      "start": { "line": 1, "column": 0 },
      "end": { "line": 7, "column": 9 }
    }
  },
  "originalParseError": true
}
