{
  "$schema": "../schema/testcase.json",
  "description": "A simple template without mustaches",
  "template": "hello\nworld",
  "input": {},
  "output": "hello\nworld",
  "ast": {
    "type": "Program",
    "body": [
      {
        "type": "ContentStatement",
        "original": "hello\nworld",
        "value": "hello\nworld",
        "loc": {
          "start": { "line": 1, "column": 0 },
          "end": { "line": 2, "column": 5 }
        }
      }
    ],
    "strip": {},
    "loc": {
      "start": { "line": 1, "column": 0 },
      "end": { "line": 2, "column": 5 }
    }
  }
}
