{
  "$schema": "../schema/testcase.json",
  "description": "Escape mustache expression",
  "template": "abc \\{{ cde",
  "input": {},
  "ast": {
    "type": "Program",
    "body": [
      {
        "type": "ContentStatement",
        "original": "abc {{ cde",
        "value": "abc {{ cde",
        "loc": {
          "start": { "line": 1, "column": 0 },
          "end": { "line": 1, "column": 11 }
        }
      }
    ],
    "strip": {},
    "loc": {
      "start": { "line": 1, "column": 0 },
      "end": { "line": 1, "column": 11 }
    }
  },
  "originalAst": {
    "type": "Program",
    "body": [
      {
        "type": "ContentStatement",
        "original": "abc ",
        "value": "abc ",
        "loc": {
          "start": { "line": 1, "column": 0 },
          "end": { "line": 1, "column": 5 }
        }
      },
      {
        "type": "ContentStatement",
        "original": "{{ cde",
        "value": "{{ cde",
        "loc": {
          "start": { "line": 1, "column": 5 },
          "end": { "line": 1, "column": 11 }
        }
      }
    ],
    "strip": {},
    "loc": {
      "start": { "line": 1, "column": 0 },
      "end": { "line": 1, "column": 11 }
    }
  },
  "output": "abc {{ cde"
}
