{
  "$schema": "../schema/testcase.json",
  "description": "A simple mustache with html-escaped output",
  "template": "{{ value }}",
  "input": { "value": "abc & < > \" ' ` = 123" },
  "output": "abc &amp; &lt; &gt; &quot; &#x27; &#x60; &#x3D; 123",
  "ast": {
    "type": "Program",
    "body": [
      {
        "type": "MustacheStatement",
        "path": {
          "type": "PathExpression",
          "data": false,
          "depth": 0,
          "parts": ["value"],
          "original": "value",
          "loc": {
            "start": { "line": 1, "column": 3 },
            "end": { "line": 1, "column": 8 }
          }
        },
        "params": [],
        "escaped": true,
        "strip": { "open": false, "close": false },
        "loc": {
          "start": { "line": 1, "column": 0 },
          "end": { "line": 1, "column": 11 }
        }
      }
    ],
    "strip": {},
    "loc": {
      "start": { "line": 1, "column": 0 },
      "end": { "line": 1, "column": 11 }
    }
  }
}
